{
  "$schema": "http://json-schema.org/draft-07/schema#",
  "$id": "mormot2-monitor/analysis@1",
  "title": "mORMot2 Daily analysis payload",
  "description": "Contract Jules must satisfy when writing data/analysis/<edition>.json. The static site is generated from this file; anything outside the contract is ignored.",
  "type": "object",
  "required": ["schema", "edition", "edition_title", "intro", "tldr", "entries"],
  "additionalProperties": false,
  "properties": {
    "schema": { "const": "mormot2-monitor/analysis@1" },
    "edition": {
      "type": "string",
      "pattern": "^\\d{4}-\\d{2}-\\d{2}$",
      "description": "Must match the raw payload edition date."
    },
    "edition_title": {
      "type": "string",
      "minLength": 8,
      "maxLength": 90,
      "description": "Headline for the day, e.g. 'A nasty RW-lock race gets fixed'. No date, no 'mORMot2' prefix."
    },
    "intro": {
      "type": "string",
      "minLength": 120,
      "maxLength": 1200,
      "description": "2-4 sentences of morning-read prose: what today's batch is about and who should care. Plain English, no bullet points, no markdown."
    },
    "tldr": {
      "type": "array",
      "minItems": 1,
      "maxItems": 6,
      "items": { "type": "string", "minLength": 15, "maxLength": 220 },
      "description": "Scannable takeaways, most important first. One fact each."
    },
    "risk_level": {
      "enum": ["calm", "worth-a-look", "act-now"],
      "description": "Overall signal for a team running mORMot2 in production."
    },
    "upgrade_advice": {
      "type": "string",
      "maxLength": 600,
      "description": "Should a team pull these commits today, and what to watch for."
    },
    "entries": {
      "type": "array",
      "items": { "$ref": "#/definitions/entry" }
    },
    "themes": {
      "type": "array",
      "maxItems": 5,
      "items": {
        "type": "object",
        "required": ["title", "summary", "shas"],
        "additionalProperties": false,
        "properties": {
          "title": { "type": "string", "maxLength": 80 },
          "summary": { "type": "string", "maxLength": 700 },
          "shas": { "type": "array", "items": { "type": "string" }, "minItems": 1 }
        }
      },
      "description": "Optional grouping when several commits tell one story (a refactor spread over 6 commits)."
    },
    "notes": {
      "type": "string",
      "maxLength": 600,
      "description": "Anything the reviewer could not confirm, or context that did not fit elsewhere."
    }
  },
  "definitions": {
    "entry": {
      "type": "object",
      "required": ["sha", "headline", "category", "severity", "what_changed", "impact", "action", "confidence"],
      "additionalProperties": false,
      "properties": {
        "sha": {
          "type": "string",
          "minLength": 7,
          "description": "Full SHA from the raw payload. Every entry must map to a commit in that file."
        },
        "headline": {
          "type": "string",
          "minLength": 10,
          "maxLength": 110,
          "description": "Rewritten in plain English for a reader who does not know the codebase. Not a copy of the commit subject."
        },
        "category": {
          "enum": ["breaking", "security", "fix", "feature", "performance", "deprecation", "refactor", "compat", "tests", "docs", "chore"]
        },
        "severity": { "enum": ["critical", "high", "medium", "low"] },
        "what_changed": {
          "type": "string",
          "minLength": 40,
          "maxLength": 900,
          "description": "What the diff actually does, grounded in the code you read. Name the units, types and methods involved."
        },
        "impact": {
          "type": "string",
          "minLength": 40,
          "maxLength": 900,
          "description": "Consequence for an existing Delphi/FPC backend using mORMot2: what breaks, what gets faster, what silently changes behaviour, or explicitly 'no impact on application code'."
        },
        "action": { "enum": ["none", "review", "upgrade-recommended", "migration-required"] },
        "action_detail": {
          "type": "string",
          "maxLength": 500,
          "description": "Concrete next step: what to grep for, what to test, what to change."
        },
        "units": {
          "type": "array",
          "items": { "type": "string" },
          "description": "Pascal units touched, e.g. mormot.core.threads."
        },
        "api_changes": {
          "type": "array",
          "items": {
            "type": "object",
            "required": ["symbol", "change"],
            "additionalProperties": false,
            "properties": {
              "symbol": { "type": "string", "maxLength": 120 },
              "change": { "enum": ["added", "removed", "renamed", "signature-changed", "behaviour-changed", "deprecated"] },
              "note": { "type": "string", "maxLength": 300 }
            }
          },
          "description": "Public API surface moves only: published functions, types, properties. Skip private/internal churn."
        },
        "confidence": {
          "enum": ["confirmed", "interpretation"],
          "description": "'confirmed' = stated by the diff or the commit message; 'interpretation' = your reading of the consequences."
        }
      }
    }
  }
}
